<?xml version="1.0" encoding="UTF-8" standalone="yes"?>
<!-- 
 * Light Portal
 *
 * Copyright (c) 2009, Light Portal, Inc or third-party contributors as
 * indicated by the @author tags or express copyright attribution
 * statements applied by the authors.  All third-party contributions are
 * distributed under license by Light Portal, Inc.
 *
 * This copyrighted material is made available to anyone wishing to use, modify,
 * copy, or redistribute it subject to the terms and conditions of the GNU
 * Lesser General Public License, as published by the Free Software Foundation.
 *
 * This program is distributed in the hope that it will be useful,
 * but WITHOUT ANY WARRANTY; without even the implied warranty of MERCHANTABILITY
 * or FITNESS FOR A PARTICULAR PURPOSE.  See the GNU Lesser General Public License
 * for more details.
 *
 * You should have received a copy of the GNU Lesser General Public License
 * along with this distribution; if not, write to:
 * Free Software Foundation, Inc.
 * 51 Franklin Street, Fifth Floor
 * Boston, MA  02110-1301  USA
 *
 */
-->
<!--W3C Schema generated by XMLSpy v2006 rel. 3 U (http://www.altova.com)-->
<xs:schema xmlns:xs="http://www.w3.org/2001/XMLSchema" elementFormDefault="qualified">
	<xs:element name="title">
		<xs:simpleType>
			<xs:restriction base="xs:string"/>
		</xs:simpleType>
	</xs:element>
	<xs:element name="theme">
		<xs:simpleType>
			<xs:restriction base="xs:string"/>
		</xs:simpleType>
	</xs:element>
	<xs:element name="name">
		<xs:simpleType>
			<xs:restriction base="xs:string"/>
		</xs:simpleType>
	</xs:element>
	<xs:element name="password">
		<xs:simpleType>
			<xs:restriction base="xs:string"/>
		</xs:simpleType>
	</xs:element>
	<xs:element name="firstName">
		<xs:simpleType>
			<xs:restriction base="xs:string"/>
		</xs:simpleType>
	</xs:element>
	<xs:element name="middleName">
		<xs:simpleType>
			<xs:restriction base="xs:string"/>
		</xs:simpleType>
	</xs:element>
	<xs:element name="lastName">
		<xs:simpleType>
			<xs:restriction base="xs:string"/>
		</xs:simpleType>
	</xs:element>
	<xs:element name="email">
		<xs:simpleType>
			<xs:restriction base="xs:string"/>
		</xs:simpleType>
	</xs:element>
	<xs:element name="defaultLocale">
		<xs:simpleType>
			<xs:restriction base="xs:string"/>
		</xs:simpleType>
	</xs:element>
	<xs:element name="reCreateTable">
		<xs:simpleType>
			<xs:restriction base="xs:boolean"/>
		</xs:simpleType>
	</xs:element>
	<xs:element name="portal-security">
		<xs:complexType>
			<xs:sequence>
				<xs:element ref="application"/>
				<xs:element ref="role" minOccurs="0" maxOccurs="unbounded"/>
			</xs:sequence>
		</xs:complexType>
	</xs:element>
	<xs:element name="application">
		<xs:complexType>
			<xs:sequence>
				<xs:element ref="defaultLocale"/>
				<xs:element ref="reCreateTable"/>
			</xs:sequence>
		</xs:complexType>
	</xs:element>
	<xs:element name="role">
		<xs:complexType>
			<xs:sequence>
				<xs:element ref="name"/>
				<xs:element ref="title" minOccurs="0"/>
				<xs:element ref="theme" minOccurs="0"/>
				<xs:element ref="permissions" minOccurs="0"/>
				<xs:element ref="users" minOccurs="0"/>
			</xs:sequence>
		</xs:complexType>
	</xs:element>
	<xs:element name="permission">
		<xs:simpleType>
			<xs:restriction base="xs:string"/>
		</xs:simpleType>
	</xs:element>
	<xs:element name="permissions">
		<xs:complexType>
			<xs:sequence>
				<xs:element ref="permission" maxOccurs="unbounded"/>
			</xs:sequence>
		</xs:complexType>
	</xs:element>
	<xs:element name="user">
		<xs:complexType>
			<xs:sequence>
				<xs:element ref="name"/>
				<xs:element ref="password"/>
				<xs:element ref="firstName"/>
				<xs:element ref="middleName"/>
				<xs:element ref="lastName"/>
				<xs:element ref="email"/>
			</xs:sequence>
		</xs:complexType>
	</xs:element>
	<xs:element name="users">
		<xs:complexType>
			<xs:sequence>
				<xs:element ref="user" maxOccurs="unbounded"/>
			</xs:sequence>
		</xs:complexType>
	</xs:element>
</xs:schema>
